{
  "reference_only": true,
  "production_ready": false,
  "taxonomy_implemented": false,
  "calibration_implementation": false,
  "mapper_status": "REFERENCE_ONLY",
  "case_id": "SYN-STR-000016",
  "population": "synthetic_stress",
  "source_paths": {
    "result": "knowledge/pilot/replay/synthetic_strength/results/SYN-STR-000016.json"
  },
  "saturation_source": "upper_clamp",
  "profile": {
    "schema_version": "strength_profile_design_v0.1.0-candidate",
    "identity": {
      "profile_id": "PRF-MAP-SYN_STR_000016",
      "source_case_ref": "SYN-STR-000016",
      "population": "synthetic_stress",
      "notes": "REFERENCE_ONLY runtime projection; PRODUCTION_READY=false"
    },
    "population": "synthetic_stress",
    "design_marker": "runtime_projection",
    "day_master": "giap",
    "score_reference": {
      "raw_score": 95.0,
      "normalized_score": 1.0,
      "published_score": 1.0,
      "current_v1_band": "strong",
      "score_source": "strength_engine_v1_runtime_observation",
      "score_status": "observed",
      "saturation_detected": true,
      "saturation_type": "upper_clamp"
    },
    "seasonal_state": {
      "season_branch": "mao",
      "season_element": null,
      "day_master_relation": "\u0110\u1eafc l\u1ec7nh",
      "seasonal_support_direction": "unknown",
      "seasonal_strength_state": "unknown",
      "seasonal_confidence": "unknown",
      "source": "runtime.context",
      "season": "spring",
      "season_phase": "mid_spring",
      "raw_contribution": 35.0,
      "notes": "seasonal_strength_state not inferred from month_status"
    },
    "rooting_state": {
      "day_branch_root": "unknown",
      "month_branch_root": "unknown",
      "other_branch_root": "unknown",
      "hidden_root": "unknown",
      "multiple_roots": true,
      "root_strength": "Th\u00f4ng c\u0103n 3 chi tr\u1edf l\u00ean",
      "root_distribution": [],
      "root_confidence": "unknown",
      "root_count": 4,
      "raw_contribution": 30.0,
      "notes": "per-branch loci not available from current runtime boundary"
    },
    "support_state": {
      "items": [
        {
          "category": "same_element",
          "label": "\u0110\u1ed3ng h\u00e0nh tr\u1ee3 th\u00e2n",
          "raw_contribution": 18.0,
          "provenance": "engine_context"
        }
      ],
      "summary": "\u0110\u1ed3ng h\u00e0nh tr\u1ee3 th\u00e2n",
      "bucket_total": 18.0,
      "confidence": "unknown"
    },
    "pressure_state": {
      "items": [],
      "summary": "unknown",
      "bucket_total": 0.0,
      "officer_count": 0,
      "wealth_count": 0,
      "confidence": "unknown"
    },
    "drain_state": {
      "items": [],
      "summary": "unknown",
      "bucket_total": 0.0,
      "output_count": 0,
      "confidence": "unknown"
    },
    "structural_state": {
      "items": [
        {
          "type": "combination",
          "rule_id": "cmb_001",
          "resolution_status": "probable",
          "participating_pillars": "unknown",
          "participating_elements": "unknown",
          "direction": "unknown",
          "effect_on_strength": "unknown",
          "confidence": "unknown",
          "provenance": "matched_rules"
        }
      ],
      "combination_bucket": 0.0,
      "special_bucket": 12.0,
      "clash": {
        "status": "not_available",
        "resolution_status": "not_applicable"
      },
      "punishment": {
        "status": "not_available",
        "resolution_status": "not_applicable"
      },
      "harm": {
        "status": "not_available",
        "resolution_status": "not_applicable"
      },
      "destruction": {
        "status": "not_available",
        "resolution_status": "not_applicable"
      },
      "follow_pattern": {
        "status": "not_available",
        "resolution_status": "not_applicable"
      },
      "summary": "partial_from_matched_rules",
      "confidence": "unknown"
    },
    "temperature_state": {
      "temperature_state": "warm",
      "heat_evidence": null,
      "cold_evidence": null,
      "dryness_evidence": null,
      "moisture_evidence": null,
      "temperature_conflict": false,
      "confidence": "unknown",
      "provenance": "strength_context_and_optional_temperature_engine",
      "notes": null
    },
    "conflicts": [],
    "evidence_completeness": {
      "schema_version": "strength_profile_design_v0.1.0-candidate",
      "overall": "partial",
      "by_dimension": {
        "calendar": "unknown",
        "season": "partial",
        "roots": "partial",
        "support": "partial",
        "pressure": "partial",
        "drain": "partial",
        "structure": "partial",
        "temperature": "limited",
        "expert_review": "unknown"
      },
      "notes": "completeness reflects source field presence only"
    },
    "evidence_records": [
      {
        "schema_version": "strength_profile_design_v0.1.0-candidate",
        "evidence_id": "EV-BUCKET-SEASON",
        "evidence_type": "seasonal",
        "dimension": "seasonal_strength",
        "source": "runtime.profile",
        "source_path": "knowledge/pilot/replay/synthetic_strength/results/SYN-STR-000016.json",
        "direction": "support",
        "magnitude": {
          "representation": "raw_contribution",
          "ordinal": null,
          "categorical": null,
          "raw_contribution": 35.0,
          "normalized": null,
          "bounded_contribution": null,
          "unit_note": "engine_bucket_or_ledger_score"
        },
        "polarity": "positive",
        "confidence": "unknown",
        "provenance": {
          "schema_version": "strength_profile_design_v0.1.0-candidate",
          "provenance_class": "derived",
          "availability": "observed",
          "source_system": "strength_engine_v1_runtime_observation",
          "source_path": "knowledge/pilot/replay/synthetic_strength/results/SYN-STR-000016.json",
          "rule_id": null,
          "observed_at": null,
          "notes": "REFERENCE_ONLY mapping; no new evidence invented"
        },
        "explanation": "observed_season_bucket",
        "affected_element": "moc",
        "affected_day_master": "giap",
        "pillar_scope": "unknown",
        "branch_scope": "mao",
        "stem_scope": null,
        "seasonal_context": {
          "month_status": "\u0110\u1eafc l\u1ec7nh",
          "season": "spring"
        },
        "interaction_context": null,
        "availability": "observed",
        "completeness": "partial",
        "information_loss": "compressed"
      },
      {
        "schema_version": "strength_profile_design_v0.1.0-candidate",
        "evidence_id": "EV-BUCKET-ROOT",
        "evidence_type": "rooting",
        "dimension": "rooting",
        "source": "runtime.profile",
        "source_path": "knowledge/pilot/replay/synthetic_strength/results/SYN-STR-000016.json",
        "direction": "support",
        "magnitude": {
          "representation": "raw_contribution",
          "ordinal": null,
          "categorical": null,
          "raw_contribution": 30.0,
          "normalized": null,
          "bounded_contribution": null,
          "unit_note": "engine_bucket_or_ledger_score"
        },
        "polarity": "positive",
        "confidence": "unknown",
        "provenance": {
          "schema_version": "strength_profile_design_v0.1.0-candidate",
          "provenance_class": "derived",
          "availability": "observed",
          "source_system": "strength_engine_v1_runtime_observation",
          "source_path": "knowledge/pilot/replay/synthetic_strength/results/SYN-STR-000016.json",
          "rule_id": null,
          "observed_at": null,
          "notes": "REFERENCE_ONLY mapping; no new evidence invented"
        },
        "explanation": "observed_root_bucket",
        "affected_element": "moc",
        "affected_day_master": "giap",
        "pillar_scope": "unknown",
        "branch_scope": "mao",
        "stem_scope": null,
        "seasonal_context": null,
        "interaction_context": null,
        "availability": "observed",
        "completeness": "partial",
        "information_loss": "compressed"
      },
      {
        "schema_version": "strength_profile_design_v0.1.0-candidate",
        "evidence_id": "EV-BUCKET-SUPPORT",
        "evidence_type": "support",
        "dimension": "same_element_support",
        "source": "runtime.profile",
        "source_path": "knowledge/pilot/replay/synthetic_strength/results/SYN-STR-000016.json",
        "direction": "support",
        "magnitude": {
          "representation": "raw_contribution",
          "ordinal": null,
          "categorical": null,
          "raw_contribution": 18.0,
          "normalized": null,
          "bounded_contribution": null,
          "unit_note": "engine_bucket_or_ledger_score"
        },
        "polarity": "positive",
        "confidence": "unknown",
        "provenance": {
          "schema_version": "strength_profile_design_v0.1.0-candidate",
          "provenance_class": "derived",
          "availability": "observed",
          "source_system": "strength_engine_v1_runtime_observation",
          "source_path": "knowledge/pilot/replay/synthetic_strength/results/SYN-STR-000016.json",
          "rule_id": null,
          "observed_at": null,
          "notes": "REFERENCE_ONLY mapping; no new evidence invented"
        },
        "explanation": "observed_support_bucket",
        "affected_element": "moc",
        "affected_day_master": "giap",
        "pillar_scope": "unknown",
        "branch_scope": "mao",
        "stem_scope": null,
        "seasonal_context": null,
        "interaction_context": null,
        "availability": "observed",
        "completeness": "partial",
        "information_loss": "compressed"
      },
      {
        "schema_version": "strength_profile_design_v0.1.0-candidate",
        "evidence_id": "EV-BUCKET-DRAIN",
        "evidence_type": "drain",
        "dimension": "output_drain",